{
  "$schema": "",
  "coverage": {
    "gaps": [],
    "paths_covered": [
      "99-PATH-1"
    ],
    "properties_covered": [
      "99-PROP-1"
    ],
    "requirements_covered": [
      "99-REQ-1.1",
      "99-REQ-1.E1"
    ]
  },
  "edge_case_tests": [
    {
      "assertion_pseudocode": "ASSERT err != nil",
      "description": "missing file returns error",
      "expected": {
        "error": "not nil"
      },
      "id": "TS-99-E1",
      "input": {
        "dir": "/nonexistent"
      },
      "kind": "unit",
      "preconditions": [],
      "requirement_id": "99-REQ-1.E1"
    }
  ],
  "property_tests": [
    {
      "description": "round-trip idempotency",
      "for_any_strategy": "valid spec fixtures",
      "id": "TS-99-P1",
      "invariant_check": "load-save-load produces deeply equal specs",
      "property_id": "99-PROP-1",
      "validates": [
        "99-REQ-1.1"
      ]
    }
  ],
  "schema_version": 1,
  "smoke_tests": [
    {
      "description": "full load path end-to-end",
      "execution_path_id": "99-PATH-1",
      "expected_effects": [
        "spec populated with all four artifacts"
      ],
      "id": "TS-99-SMOKE-1",
      "mockable": [],
      "real_components": [
        "filesystem",
        "parser"
      ],
      "trigger": "LoadSpec(dir)"
    }
  ],
  "spec_id": "99",
  "spec_name": "golden",
  "test_cases": [
    {
      "assertion_pseudocode": "ASSERT spec.PRD.Frontmatter.SpecID == \"99\"",
      "description": "load a valid spec folder",
      "expected": {
        "spec_id": "99"
      },
      "id": "TS-99-1",
      "input": {
        "dir": "testdata/valid_spec"
      },
      "kind": "integration",
      "preconditions": [],
      "requirement_id": "99-REQ-1.1"
    }
  ]
}
