{
  "$schema": "https://agent-fox.dev/schemas/test_spec.v1.json",
  "spec_id": "01",
  "spec_name": "test_feature",
  "schema_version": 1,
  "test_cases": [
    {
      "id": "TS-01-1",
      "requirement_id": "01-REQ-1.1",
      "kind": "unit",
      "description": "Spec type exports all four artifacts",
      "preconditions": [],
      "input": {},
      "expected": {
        "has_prd": true,
        "has_requirements": true,
        "has_test_spec": true,
        "has_tasks": true
      },
      "assertion_pseudocode": "spec = load_spec(dir); assert spec.prd is not None"
    }
  ],
  "property_tests": [
    {
      "id": "TS-01-P1",
      "property_id": "01-PROP-1",
      "validates": [
        "01-REQ-1.1"
      ],
      "description": "Round-trip idempotency",
      "for_any_strategy": "valid golden fixture spec folder",
      "invariant_check": "load(save(load(fixture))) == load(fixture)"
    }
  ],
  "edge_case_tests": [
    {
      "id": "TS-01-E1",
      "requirement_id": "01-REQ-1.E1",
      "kind": "unit",
      "description": "Missing file raises LoadError",
      "preconditions": [
        "directory with missing test_spec.json"
      ],
      "input": {
        "missing_file": "test_spec.json"
      },
      "expected": {
        "error_type": "LoadError"
      },
      "assertion_pseudocode": "with raises(LoadError): load_spec(incomplete_dir)"
    }
  ],
  "smoke_tests": [
    {
      "id": "TS-01-SMOKE-1",
      "execution_path_id": "01-PATH-1",
      "description": "Load spec from disk end-to-end",
      "trigger": "load_spec(golden_dir)",
      "real_components": [
        "io",
        "models"
      ],
      "mockable": [],
      "expected_effects": [
        "Returns Spec with all four artifacts populated"
      ]
    }
  ],
  "coverage": {
    "requirements_covered": [
      "01-REQ-1.1",
      "01-REQ-1.E1"
    ],
    "properties_covered": [
      "01-PROP-1"
    ],
    "paths_covered": [
      "01-PATH-1"
    ],
    "gaps": []
  }
}
