{
  "$schema": "",
  "coverage": {
    "gaps": [],
    "paths_covered": [],
    "properties_covered": [],
    "requirements_covered": [
      "99-REQ-1.1"
    ]
  },
  "edge_case_tests": [],
  "property_tests": [],
  "schema_version": 1,
  "smoke_tests": [],
  "spec_id": "99",
  "spec_name": "draft_spec",
  "test_cases": [
    {
      "assertion_pseudocode": "ASSERT spec != nil",
      "description": "load draft spec",
      "expected": {},
      "id": "TS-99-1",
      "input": {},
      "kind": "unit",
      "preconditions": [],
      "requirement_id": "99-REQ-1.1"
    }
  ]
}
